id,category,pubDate,title,tags,suggested_tags
vlogs/orc-bases-and-flesh.mdx,Vlogs,2026-05-17,Orc bases and flesh,"basing, orcs-and-goblins","basing, orcs-and-goblins"
vlogs/paint-and-ramble-hobby-pressure.mdx,Vlogs,2025-10-30,Paint & Ramble: Hobby Pressure,"motivation, collection, mental-health, painting-goblins","hobby-motivation, collection, mental-health, painting"
vlogs/paint-and-ramble-night.mdx,Vlogs,2026-02-26,Paint and Ramble Night,"painting, infinity, commission, scale-75, blending, basing, nurgle","painting, infinity, commission, scale-75, blending, basing, nurgle"
vlogs/paint-and-ramble-vlog.mdx,Vlogs,2025-12-30,Paint and Ramble Vlog,"warmachine, crucible-guard, speed-painting, army-painter, vlog, warjacks","warmachine, crucible-guard, speed-painting, army-painter, vlog, warjacks"
vlogs/painting-and-ranting-about-game-design.mdx,Vlogs,2026-03-15,Painting and Ranting about Game Design,"game-design, mordheim, painting, glazing, infinity, maximus, crown-and-skull, war-machine","ttrpg, mordheim, painting, glazing, infinity, maximus, crown-and-skull, warmachine"
vlogs/painting-blue-and-planning-the-next-couple-of-projects.mdx,Vlogs,2026-05-23,Painting blue and planning the next couple of projects.,painting,painting
vlogs/painting-dirt-hobby-vlog-99.mdx,Vlogs,2025-12-19,Painting Dirt - Hobby Vlog 99,"terrain, painting, vlog, mage-knight, mail-day","terrain, painting, vlog, mage-knight, unboxing"
vlogs/painting-some-infinity-models.mdx,Vlogs,2026-04-26,Painting some infinity models,"painting, airbrushing, orcs-and-goblins, model-prep, basing, eyes, contrast-paints","painting, airbrushing, orcs-and-goblins, model-prep, basing, eyes, contrast-paints"
vlogs/quick-hobby-update.mdx,Vlogs,2026-04-05,Quick Hobby Update,"painting, 3d-printing, live-stream, resin-casting, model-prep, dusk, snow-effects","painting, 3d-printing, live-stream, resin-casting, model-prep, dusk, snow-effects"
vlogs/quick-vlog-day-97.mdx,Vlogs,2025-12-17,Sealing the Terrain Board and Printing a Vulcan,"terrain, 3d-printing, crucible-guard, warmachine, vlog","terrain, 3d-printing, crucible-guard, warmachine, vlog"
vlogs/quick-vlog-update-rip-airbrush.mdx,Vlogs,2025-09-29,My 12-Year-Old Airbrush Died Mid-Priming,"airbrushing, troubleshooting, circle-oroboros, priming, livestream","airbrushing, troubleshooting, circle-oroboros, priming, live-stream"
vlogs/quick-vlog.mdx,Vlogs,2025-11-13,Hobby Queue Check-In: What's Next on the Bench,vlog,vlog
vlogs/rip-to-my-heat-gun.mdx,Vlogs,2026-04-21,RIP to my heat gun,"painting, glazing, metal, airbrushing, blending, dusk, snow-effects","painting, glazing, metal, airbrushing, blending, dusk, snow-effects"
vlogs/self-reflection-and-story-time.mdx,Vlogs,2025-11-18,Self Reflection & Story Time,"personal, hobby-organization, hobby-planning, golden-demon","workspace, golden-demon"
vlogs/showing-off-some-warmachine-minis.mdx,Vlogs,2025-10-24,Showing Off Some Warmachine Minis,"warmachine, menoth, goblins, contrast-paints, collection","warmachine, menoth, goblins, contrast-paints, collection"
vlogs/sick-q-a.mdx,Vlogs,2026-03-26,Sick Q&A,"q-and-a, castle-grief, calarrath, kingdom-death, solo-rpg, laser-engraving, smash-bash","q-and-a, castle-grief, kal-arath, kingdom-death, solo-rpg, laser-engraving, smashbash"
vlogs/slowly-going-insane-removing-mould-lines.mdx,Vlogs,2025-10-08,Slowly Going Insane Removing Mould Lines,"goblins, mold-lines, assembly, old-world, motivation","goblins, mold-lines, assembly, old-world, hobby-motivation"
vlogs/smashbash-build-begins.mdx,Vlogs,2026-04-12,SmashBash Build Begins,"building, smashbash","building, smashbash"
vlogs/solo-roleplaying-session-0-part-1-intro-to-the-system.mdx,Vlogs,2025-11-17,Solo Roleplaying Session 0 Part 1: Intro to the System,"crown-and-skull, solo-rpg, runehammer, ttrpg, dice","crown-and-skull, solo-rpg, runehammer, ttrpg, dice"
vlogs/some-late-night-reading-after-this-came-in-the-mail-today.mdx,Vlogs,2026-04-29,Some Late Night Reading After This Came in the Mail Today,unboxing,unboxing
vlogs/spicing-up-some-relic-blade-tokens.mdx,Vlogs,2026-05-15,Spicing up some relic blade tokens.,relicblade,relicblade
vlogs/started-on-the-loincloth.mdx,Vlogs,2025-11-29,Started on the Loincloth,"infinity, glazing, scale-75, painting, vlog","infinity, glazing, scale-75, painting, vlog"
vlogs/super-fast-osl.mdx,Vlogs,2026-05-11,Super fast OSL,"painting, airbrushing, contrast-paints, osl","painting, airbrushing, contrast-paints, osl"
vlogs/taking-a-look-at-inquisitor-kroyle.mdx,Vlogs,2026-05-13,Taking a look at Inquisitor Kroyle,"painting, kitbashing, unboxing, warmachine, warhammer","painting, kitbashing, unboxing, warmachine, warhammer"
vlogs/the-first-miniatures-i-ever-painted.mdx,Vlogs,2025-12-01,The First Miniatures I Ever Painted,"mage-knight, nostalgia, first-miniatures, collection, tournament-history","mage-knight, first-miniatures, collection, tournament-history"
vlogs/thoughts-on-90-days-of-hobby-vlogging.mdx,Vlogs,2025-12-10,Thoughts On 90 Days of Hobby Vlogging,"milestone, vlog, dolmenwood","milestone, vlog, dolmenwood"
vlogs/tips-for-batch-painting-unique-models.mdx,Vlogs,2026-05-01,Tips for Batch Painting Unique Models,"painting, batch-painting, tips, infinity, airbrushing, nmm","painting, speed-painting, tips, infinity, airbrushing, nmm"
vlogs/toad-giveaway.mdx,Vlogs,2025-11-03,Toad Giveaway,"giveaway, hobby-organization, collection, resin-casting","giveaway, workspace, collection, resin-casting"
vlogs/two-minute-trench-crusade-battle-recap.mdx,Vlogs,2025-11-20,Two Minute Trench Crusade Battle Recap,"trench-crusade, battle-report, event-recap, trench-pilgrims","trench-crusade, battle-report, event-recap, trench-pilgrims"
vlogs/using-speed-paints-as-a-wash.mdx,Vlogs,2026-04-13,Using Speed Paints as a Wash,"washes, painting, speed-painting, contrast-paints, battle-report, orcs-and-goblins, airbrushing","washes, painting, speed-painting, contrast-paints, battle-report, orcs-and-goblins, airbrushing"
vlogs/vlogging-hobby-struggles-to-hopefully-motivate-everyone-else.mdx,Vlogs,2025-10-22,Vlogging Hobby Struggles to Hopefully Motivate Everyone Else,"goblins, motivation, inspiration, warmachine, color-recipes","goblins, hobby-motivation, inspiration, warmachine, color-recipes"
vlogs/vlogging-my-failures-again.mdx,Vlogs,2025-10-12,"Goblins Off Bases, Bad Casts, and Homemade Music","motivation, goblins, basing, mold-making, music, learning","hobby-motivation, goblins, basing, mold-making, music, learning"
vlogs/warmachine-event-photos.mdx,Vlogs,2025-10-27,Warmachine Event Photos,"warmachine, event-recap, narrative, battle-report, menoth","warmachine, event-recap, narrative, battle-report, menoth"
vlogs/warmachine-winter-wonderland-event-photos.mdx,Vlogs,2025-12-07,Warmachine Winter Wonderland Event Photos,"warmachine, event-recap, fifth-division, kador, vlog","warmachine, event-recap, fifth-division, kador, vlog"
vlogs/why-are-3d-sculpted-models-so-overly-detailed.mdx,Vlogs,2026-04-16,Why are 3d sculpted models so overly detailed?,"painting, warmachine, cloth, metal, building, terrain, 3d-printing","painting, warmachine, cloth, metal, building, terrain, 3d-printing"
vlogs/will-i-see-another-summer-again.mdx,Vlogs,2025-12-21,Will I See Another Summer Again,"vlog, 3d-printing, basing","vlog, 3d-printing, basing"
vlogs/wtf-is-a-rectifier.mdx,Vlogs,2026-04-24,Wtf is a rectifier.,"painting, orcs-and-goblins, kitbashing","painting, orcs-and-goblins, kitbashing"
vlogs/another-warmachine-update-video.mdx,Warmachine,2026-01-18,"Rahara, Thyra, and Fifth Division List Ideas","warmachine, list-building, rahara, thyra, fifth-division, menoth","warmachine, list-building, rahara, thyra, fifth-division, menoth"
