id,category,pubDate,title,tags,suggested_tags
vlogs/make-your-own-base-texture.mdx,Tutorials,2025-09-28,Make Your Own Base Texture,"basing, tutorial, texture, budget-hobby","basing, tutorial, texture, budget-hobby"
vlogs/making-a-mold-to-recast-and-customize-miniatures.mdx,Tutorials,2026-02-16,Making a Mold to Recast and Customize Miniatures,"mold-making, resin-casting, daemon-prince, conversion, sculpting","mold-making, resin-casting, daemon-prince, conversion, sculpting"
vlogs/making-zines-is-easy-with-the-right-tools.mdx,Tutorials,2026-03-30,Making Zines Is Easy with the Right Tools,"zine-making, bookbinding, castle-grief, calarrath, diy, tutorial, crafting","zine-making, bookbinding, castle-grief, kal-arath, diy, tutorial, crafting"
vlogs/paint-a-trench-pilgrim-warband-in-2-hours.mdx,Tutorials,2025-09-24,Paint a Trench Pilgrim Warband in 2 Hours,"trench-crusade, tutorial, speed-painting, streaking-grime, liquid-chrome","trench-crusade, tutorial, speed-painting, streaking-grime, liquid-chrome"
vlogs/painting-a-belt-buckle.mdx,Tutorials,2025-11-25,Painting an NMM Belt Buckle With Scale 75 Grays,"painting, nmm, tutorial, belt-buckle, volumetric-painting, brush-control","painting, nmm, tutorial, belt-buckle, brush-control"
vlogs/painting-a-leather-belt.mdx,Tutorials,2025-11-24,Painting a Leather Belt,"leather, tutorial, infinity, painting-journey, richard-gray","leather, tutorial, infinity, painting, richard-gray"
vlogs/painting-butcher-klaus-minicrate.mdx,Tutorials,2025-12-06,Painting Butcher Klaus Minicrate,"warmachine, speed-painting, army-painter, kador, minicrate, butcher","warmachine, speed-painting, army-painter, kador, minicrate, butcher"
vlogs/painting-chaosy-green-marble.mdx,Tutorials,2026-03-11,Painting Chaosy Green Marble,"painting, marble-effect, children-of-gomb, scale-75, crystal, laser-engraver, hobgoblin, inq28","painting, marble-effect, children-of-gomb, scale-75, crystal, laser-engraving, hobgoblin, inq28"
vlogs/painting-creepy-cartoonish-skin.mdx,Tutorials,2026-03-05,Painting Creepy Cartoonish Skin,"painting, skin-tones, stippling, scale-75, sculpting, children-of-gomb, hobgoblin, inq28","painting, skin-tones, stippling, scale-75, sculpting, children-of-gomb, hobgoblin, inq28"
vlogs/painting-the-wood-on-the-love-shack.mdx,Tutorials,2025-12-03,Painting the Wood on The Love Shack,"terrain, contrast-paints, drybrushing, wood, love-shack, tutorial","terrain, contrast-paints, dry-brushing, wood, love-shack, tutorial"
vlogs/probably-not-the-worst-chainmail-tutorial-ever.mdx,Tutorials,2026-03-19,Probably Not the Worst Chainmail Tutorial Ever,"chainmail, painting, speed-paints, dry-brushing, molotow-liquid-chrome, normans, tutorial","chainmail, painting, speed-painting, dry-brushing, liquid-chrome, normans, tutorial"
vlogs/scenic-and-magnetic-movement-trays-part-1.mdx,Tutorials,2026-02-28,Scenic and Magnetic Movement Trays Part 1,"movement-trays, magnets, 3d-printing, midgard, basing, vallejo, tutorial","movement-trays, magnets, 3d-printing, midgard, basing, vallejo, tutorial"
vlogs/scenic-movement-trays-part-2.mdx,Tutorials,2026-03-01,Scenic Movement Trays Part 2,"movement-trays, basing, vallejo, gamers-grass, drybrushing, midgard, 3d-printing","movement-trays, basing, vallejo, gamers-grass, dry-brushing, midgard, 3d-printing"
vlogs/simple-lego-minifig-bases-for-dnd.mdx,Tutorials,2026-01-21,Simple Lego Minifig Bases for D&D,"lego, dungeons-and-dragons, basing, tutorial, terrain","lego, dungeons-and-dragons, basing, tutorial, terrain"
vlogs/starting-the-year-with-true-metal-metallics.mdx,Tutorials,2026-01-01,Starting the Year with True Metal Metallics,"tmm, warmachine, crucible-guard, warjacks, speed-painting, new-year","metal, warmachine, crucible-guard, warjacks, speed-painting, new-year"
vlogs/the-best-snow-effect-ever.mdx,Tutorials,2025-12-05,The Best Snow Effect Ever,"terrain, snow-effects, crushed-glass, tutorial, love-shack, weathering","terrain, snow-effects, crushed-glass, tutorial, love-shack, weathering"
vlogs/the-jankiest-rust-tutorial-ever.mdx,Tutorials,2025-10-28,The Jankiest Rust Tutorial Ever,"rust, tutorial, dirty-down, weathering, goblins, speed-painting","rust, tutorial, dirty-down, weathering, goblins, speed-painting"
vlogs/trench-crusade-bases-weathering-finishing-our-warband-part-1.mdx,Tutorials,2025-09-26,Trench Crusade Bases & Weathering - Finishing our Warband Part 1,"trench-crusade, weathering, pigments, tutorial, nilakh-oxide, basing","trench-crusade, weathering, pigments, tutorial, nilakh-oxide, basing"
vlogs/using-tarot-cards-and-casting-bones-to-create-deeper-roleplaying-characters.mdx,Tutorials,2025-12-12,Using Tarot Cards & Casting Bones to Create Deeper Roleplaying Characters,"dolmenwood, ttrpg, character-creation, tarot, solo-rpg, divination","dolmenwood, ttrpg, tarot, solo-rpg, divination"
vlogs/100-sub-giveaway-and-2026-goals.mdx,Vlogs,2026-01-05,100 Sub Giveaway and 2026 Goals,"giveaway, hobby-planning, warmachine, crucible-guard, old-world","giveaway, workspace, warmachine, crucible-guard, old-world"
vlogs/3d-printing-kdm-terrain.mdx,Vlogs,2026-02-07,3D Printing KDM Terrain,"3d-printing, kingdom-death, terrain, resin-printing","3d-printing, kingdom-death, terrain"
vlogs/3d-printing-kind-of-sucks.mdx,Vlogs,2025-11-04,3D Printing Kind of Sucks,"3d-printing, resin, hobby-thoughts, hobby-planning, personal","3d-printing, resin-casting, workspace"
vlogs/40-minute-painting-tutorial.mdx,Vlogs,2026-05-20,40 minute painting tutorial,"painting, glazing, infinity","painting, glazing, infinity"
vlogs/a-christmas-oil-wash.mdx,Vlogs,2025-12-25,A Christmas Oil Wash,"terrain, oil-wash, vlog, christmas, wargaming-boards","terrain, oil-wash, vlog, christmas, wargaming-boards"
vlogs/almost-done-with-the-first-mini-of-2026.mdx,Vlogs,2026-01-02,Almost Done with the First Mini of 2026,"warmachine, crucible-guard, edge-highlighting, washes, vlog, dolmenwood","warmachine, crucible-guard, edge-highlighting, washes, vlog, dolmenwood"
vlogs/almost-done.mdx,Vlogs,2026-05-24,Almost done,"painting, glazing, infinity","painting, glazing, infinity"
vlogs/anime-filler-episode.mdx,Vlogs,2026-05-03,"Prima Materia Dice, Orc the Brand, and a Foam Haul","work-in-progress, necromunda, terrain, building","work-in-progress, necromunda, terrain, building"
vlogs/another-board-done.mdx,Vlogs,2025-12-26,Finishing a Mossy Terrain Board With an Oil Wash,"terrain, oil-wash, vlog, wargaming-boards","terrain, oil-wash, vlog, wargaming-boards"
vlogs/another-easy-way-to-paint-faces.mdx,Vlogs,2026-05-11,Another easy way to paint faces,"eyes, painting, airbrushing, washes, glazing, metal, orcs-and-goblins","eyes, painting, airbrushing, washes, glazing, metal, orcs-and-goblins"
vlogs/another-new-project-kinda.mdx,Vlogs,2026-03-10,A Surprise Laser Engraver (and Near-Toxic Gas),"laser-engraver, basing, painting, random-hobby-day","laser-engraving, basing, painting"
vlogs/another-random-hobby-day.mdx,Vlogs,2026-02-23,"Iso Alcohol Mud Texture, a Studio Cleanup, and a Giveaway","3d-printing, hobby-organization, terrain, board-building, cleaning, giveaway, kingdom-death, midgard, warmachine","3d-printing, workspace, terrain, board-building, cleaning, giveaway, kingdom-death, midgard, warmachine"
vlogs/april-3-2026.mdx,Vlogs,2026-04-03,Building Terrain in the Sun,"building, terrain","building, terrain"
vlogs/asmr-drybrushing.mdx,Vlogs,2025-12-24,ASMR Drybrushing,"terrain, drybrushing, vlog, christmas-eve, wargaming-boards","terrain, dry-brushing, vlog, christmas-eve, wargaming-boards"
vlogs/bald-man-rants-about-ai.mdx,Vlogs,2026-01-08,Bald Man Rants About AI,"ai, generative-ai, creativity, painting, warmachine","ai, hobby-motivation, painting, warmachine"
vlogs/basing-and-life-tips.mdx,Vlogs,2026-01-07,Basing and Life Tips,"basing, flock, vlog, motivation, painting","basing, flock, vlog, hobby-motivation, painting"
vlogs/bellwoken-whimsical-army-set.mdx,Vlogs,2026-05-30,Bellwoken: A New Whimsical Army Set for Your Wargames,,
vlogs/building-and-cleaning-today.mdx,Vlogs,2025-11-16,Building and Cleaning Today,"hobby-organization, model-building, vlog","workspace, building, vlog"
vlogs/building-and-paint-prep-day.mdx,Vlogs,2025-12-27,Building and Paint Prep Day,"vlog, trench-crusade, crucible-guard, warmachine, model-building, hobby-planning","vlog, trench-crusade, crucible-guard, warmachine, building, workspace"
vlogs/building-more-figures-for-trench-crusade.mdx,Vlogs,2025-11-19,Building More Figures for Trench Crusade,"trench-crusade, model-building, mage-knight, chainmail, trench-pilgrims","trench-crusade, building, mage-knight, chainmail, trench-pilgrims"
vlogs/building-sunrot-miscast-and-newest-gardens-of-hecate-minis.mdx,Vlogs,2026-03-28,"Building Sunrot, Miscast, and Gardens of Hecate Minis","building, sunrot, miscast, gardens-of-hecate, miniatures, hobby-zen, model-prep","building, sunrot, miscast, gardens-of-hecate, miniatures, model-prep"
vlogs/ceiling-fan-wisdom.mdx,Vlogs,2026-04-08,Ceiling Fan Wisdom,painting,painting
vlogs/channel-update.mdx,Vlogs,2026-02-12,Channel Update,"personal, hobby-nomicon, kingdom-death, warmachine, motivation","kingdom-death, warmachine, hobby-motivation"
vlogs/coffee-cup-part-1.mdx,Vlogs,2026-05-16,Coffee Cup Part 1,"monster-friends, 3d-printing, tokens, painting, pre-shading, basing","monster-friends, 3d-printing, tokens, painting, preshading, basing"
vlogs/coffee-cup.mdx,Vlogs,2026-05-22,Coffee cup,painting,painting
vlogs/creating-space-for-creativity.mdx,Vlogs,2025-10-03,What 20 Days of Daily Vlogging Taught Me About Creativity,"creativity, motivation, the-war-of-art, orcs","hobby-motivation, orcs"
vlogs/currently-on-the-work-bench.mdx,Vlogs,2026-06-02,Currently on the work bench,orcs-and-goblins,orcs-and-goblins
vlogs/daily-hobby-vlog-161.mdx,Vlogs,2026-02-20,Salvaging an Old Shelf Into a 16x16 Game Board,"vlog, resin-casting, terrain, board-building, problem-solving, mdf","vlog, resin-casting, terrain, board-building, problem-solving, mdf"
vlogs/daily-hobby-vlog-fixing-some-problems-and-causing-more.mdx,Vlogs,2025-10-11,Re-Cutting a Toad Mold and Gluing Goblins Wrong,"resin-casting, mold-making, goblins, basing, mistakes, sculpting","resin-casting, mold-making, goblins, basing, mistakes, sculpting"
vlogs/daily-hobby-vlog-march-13th.mdx,Vlogs,2026-03-13,Relic Blade Launch Day and Glazing Maximus,"relicblade, infinity, commission, painting, glazing, maximus","relicblade, infinity, commission, painting, glazing, maximus"
vlogs/daily-hobby-vlog-update-1.mdx,Vlogs,2026-04-19,Daily Hobby Vlog Update — April 18,work-in-progress,work-in-progress
vlogs/daily-hobby-vlog-update.mdx,Vlogs,2026-04-22,Daily Hobby Vlog Update — April 21,work-in-progress,work-in-progress
vlogs/day-4-vlog.mdx,Vlogs,2025-09-14,Magnetizing Bases and Fixing a Foam Board Disaster,"vlog, magnets, molly-crew, foam, gratitude","vlog, magnets, motley-crews, foam"
vlogs/dolmenwood-official-figures-dolmenwood-miniature-dungeonsanddragons.mdx,Vlogs,2025-12-10,Dolmenwood official figures. #dolmenwood #miniature #dungeonsanddragons,"dolmenwood, wood","dolmenwood, wood"
vlogs/failed-attempt-at-nmm-tutorial.mdx,Vlogs,2026-04-25,Failed attempt at NMM tutorial,"painting, metal, airbrushing, glazing, showcase, nmm, eyes","painting, metal, airbrushing, glazing, showcase, nmm, eyes"
vlogs/final-mail-day-for-a-while.mdx,Vlogs,2026-03-27,Final Mail Day for a While,"unboxing, gardens-of-hecate, meridian-miniatures, andrew-may, relicblade, warmachine, miniatures","unboxing, gardens-of-hecate, meridian-miniatures, andrew-may, relicblade, warmachine, miniatures"
vlogs/finally-primed-the-orcs-and-goblins.mdx,Vlogs,2025-10-19,Finally Primed the Orcs & Goblins,"airbrushing, priming, orcs, goblins, creos-771, unboxing","airbrushing, priming, orcs, goblins, creos-771, unboxing"
vlogs/finding-ways-to-make-progress.mdx,Vlogs,2025-10-02,"When the Airbrush Breaks, Paint a 20-Year-Old Goblin","orcs, goblins, motivation, kitbashing, warhammer","orcs, goblins, hobby-motivation, kitbashing, warhammer"
vlogs/finishing-up-random-projects-before-starting-the-next-one.mdx,Vlogs,2025-11-22,Finishing Up Random Projects Before Starting the Next One,"maps, framing, 3d-printing, warmachine, hobby-organization, golden-demon","maps, framing, 3d-printing, warmachine, workspace, golden-demon"
vlogs/finishing-up-the-dnd-cards.mdx,Vlogs,2026-03-08,Finishing Up the D&D Cards,"dungeons-and-dragons, collection, dark-sun, ravenloft, mail-day, sunrot","dungeons-and-dragons, collection, dark-sun, ravenloft, unboxing, sunrot"
vlogs/finishing-up-the-nmm.mdx,Vlogs,2026-05-21,Finishing up the NMM,painting,painting
vlogs/first-live-stream.mdx,Vlogs,2025-09-29,First Live Stream,"priming, livestream","priming, live-stream"
vlogs/giveaway-winner.mdx,Vlogs,2026-01-14,Giveaway Winner!,"giveaway, milestone, mage-knight, cleaning, terrain, warmachine","giveaway, milestone, mage-knight, cleaning, terrain, warmachine"
vlogs/gw-got-me-again.mdx,Vlogs,2026-04-23,GW got me again,"warhammer, orcs-and-goblins, snow-effects, kitbashing, building, terrain, painting","warhammer, orcs-and-goblins, snow-effects, kitbashing, building, terrain, painting"
vlogs/halloween-channel-update.mdx,Vlogs,2025-10-31,Halloween Channel Update,"halloween, goblins, warmachine, competition","halloween, goblins, warmachine, competition"
vlogs/highlighting-black.mdx,Vlogs,2026-04-20,Highlighting black,"painting, glazing, eyes, orcs-and-goblins, blending, model-prep, metal","painting, glazing, eyes, orcs-and-goblins, blending, model-prep, metal"
vlogs/highlighting-red.mdx,Vlogs,2026-04-15,Highlighting red,"painting, orcs-and-goblins, edge-highlighting, airbrushing, dry-brushing, washes, metal","painting, orcs-and-goblins, edge-highlighting, airbrushing, dry-brushing, washes, metal"
vlogs/hobbinomicon-com.mdx,Vlogs,2026-05-18,Hobbinomicon.com,"site-update, indie-games, warmachine, steamforged-games, unboxing","indie-games, warmachine, steamforged-games, unboxing"
vlogs/hobby-hang-out-clips.mdx,Vlogs,2026-03-14,Hobby Hang Out Clips,"painting, infinity, commission, glazing, edge-highlighting, maximus","painting, infinity, commission, glazing, edge-highlighting, maximus"
vlogs/hobby-vlog-and-terrain-inspiration.mdx,Vlogs,2026-03-20,Hobby Vlog and Terrain Inspiration,"chainmail, painting, speed-paints, normans, relicblade, terrain-inspiration","chainmail, painting, speed-painting, normans, relicblade, terrain-inspiration"
vlogs/hobby-vlog-day-117.mdx,Vlogs,2026-01-06,Hobby Vlog Day 117,"dolmenwood, vlog, basing, flock, warmachine, dusk, hobby-planning","dolmenwood, vlog, basing, flock, warmachine, dusk, workspace"
vlogs/hobby-vlog-day-148.mdx,Vlogs,2026-02-06,Hobby Vlog Day 148,"vlog, 3d-printing, kingdom-death, lego, unboxing, butcher","vlog, 3d-printing, kingdom-death, lego, unboxing, butcher"
vlogs/hobby-vlog-day-79.mdx,Vlogs,2025-11-28,Hobby Vlog Day 79,"trench-crusade, vlog, book-of-antithesis, hobby-organization, ttrpg, dolmenwood","trench-crusade, vlog, book-of-antithesis, workspace, ttrpg, dolmenwood"
vlogs/hobby-vlog-day-95.mdx,Vlogs,2025-12-16,Hobby Vlog Day 95,"dolmenwood, ttrpg, character-creation, vlog","dolmenwood, ttrpg, vlog"
vlogs/hobby-vlogging.mdx,Vlogs,2025-10-16,Rebasing 60 Goblins and Pouring a Base Mold,"goblins, basing, mold-making, glazing, mangler-squigs, orcs","goblins, basing, mold-making, glazing, mangler-squigs, orcs"
vlogs/how-not-to-paint-yellow-warmachine-update.mdx,Vlogs,2026-01-15,How Not to Paint Yellow / Surprise Warmachine Update Thoughts,"painting, yellow, warmachine, dolmenwood, breggle","painting, yellow, warmachine, dolmenwood, breggle"
vlogs/how-to-get-better-by-playing-yourself.mdx,Vlogs,2026-04-10,How to Get Better by Playing Yourself,"warmachine, snow-effects, terrain, orcs-and-goblins, resin-casting, battle-report, menoth","warmachine, snow-effects, terrain, orcs-and-goblins, resin-casting, battle-report, menoth"
vlogs/how-to-paint-white-robes.mdx,Vlogs,2026-04-03,How to Paint White Robes,"painting, cloth, glazing, orcs-and-goblins, airbrushing, basing, live-stream","painting, cloth, glazing, orcs-and-goblins, airbrushing, basing, live-stream"
vlogs/how-to-speed-paint-faces.mdx,Vlogs,2026-05-10,How to speed paint faces,"painting, eyes, glazing, tips, orcs-and-goblins, 3d-printing, hobby-tools","painting, eyes, glazing, tips, orcs-and-goblins, 3d-printing, hobby-tools"
vlogs/how-to-start-commission-painting-and-why-you-maybe-shouldn-t.mdx,Vlogs,2026-04-01,How to Start Commission Painting and Why You Maybe Shouldn't,"painting, buying-selling, snow-effects, terrain, orcs-and-goblins, warhammer, speed-painting","painting, buying-selling, snow-effects, terrain, orcs-and-goblins, warhammer, speed-painting"
vlogs/how-to-wash-bright-red.mdx,Vlogs,2026-04-11,How to Wash Bright Red,"washes, painting, airbrushing, battle-report, orcs-and-goblins, speed-painting, dusk","washes, painting, airbrushing, battle-report, orcs-and-goblins, speed-painting, dusk"
vlogs/i-can-paint-and-ramble-again.mdx,Vlogs,2026-05-09,I can paint and ramble again.,"painting, airbrushing, metal, 3d-printing, orcs-and-goblins, speed-painting, buying-selling","painting, airbrushing, metal, 3d-printing, orcs-and-goblins, speed-painting, buying-selling"
vlogs/i-cleaned-my-workbench.mdx,Vlogs,2026-03-31,I Cleaned My Workbench,"hobby-space, live-stream, warmachine, dusk, commission, smash-bash, sunrot","hobby-space, live-stream, warmachine, dusk, commission, smashbash, sunrot"
vlogs/i-finished-the-infinity-models.mdx,Vlogs,2026-05-26,I finished the infinity models,infinity,infinity
vlogs/i-m-late-but-this-is-so-good.mdx,Vlogs,2026-03-25,I’m late but this is so good.,,
vlogs/i-took-two-days-to-paint-a-candy-cane.mdx,Vlogs,2026-01-31,I Took Two Days to Paint a Candy Cane,"painting, hobby-streak, vlog, lego, butcher","painting, vlog, lego, butcher"
vlogs/if-you-can-make-it-through-today-you-can-make-it-through-tomorrow.mdx,Vlogs,2026-01-09,If You Can Make It Through Today You Can Make It Through Tomorrow,"motivation, hobby-streak, personal, warmachine","hobby-motivation, warmachine"
vlogs/im-not-a-competitive-wargamer-anymore.mdx,Vlogs,2026-01-19,I'm Not a Competitive Wargamer Anymore,"warmachine, competition, motivation, wargaming, painting, personal, commission","warmachine, competition, hobby-motivation, wargaming, painting, commission"
vlogs/infernal-diaries-day-1.mdx,Vlogs,2026-04-07,Infernal Diaries Day 1,"basing, painting, warmachine, orcs-and-goblins, snow-effects, 3d-printing, terrain","basing, painting, warmachine, orcs-and-goblins, snow-effects, 3d-printing, terrain"
vlogs/infernal-diaries-two-quick-channel-update.mdx,Vlogs,2026-04-27,Infernal diaries two - quick channel update.,"painting, event-photos, warmachine, orcs-and-goblins, dusk, work-in-progress","painting, event-photos, warmachine, orcs-and-goblins, dusk, work-in-progress"
vlogs/its-ok-to-not-paint-your-miniatures.mdx,Vlogs,2025-11-06,It's Ok to Not Paint Your Miniatures,"motivation, infinity","hobby-motivation, infinity"
vlogs/just-rambling.mdx,Vlogs,2025-09-18,A Game Board Turned Into Its Own World,"motivation, terrain, personal, community, mollog","hobby-motivation, terrain, community, mollog"
vlogs/just-showing-up-fixed-my-3d-printer.mdx,Vlogs,2025-10-18,Fixing My 3D Printer by Reflashing the Firmware,"3d-printing, troubleshooting, goblins, mordheim, hobby-streak","3d-printing, troubleshooting, goblins, mordheim"
vlogs/just-vloggin.mdx,Vlogs,2025-11-02,Just Vloggin,"mangler-squigs, goblins, old-world, vlog, gardens-of-hecati","mangler-squigs, goblins, old-world, vlog, gardens-of-hecate"
vlogs/kal-arath-episode-2.mdx,Vlogs,2026-05-04,Kal Arath Episode 2,"kal-arath, solo-rpg, rpg-session, prima-materia","kal-arath, solo-rpg, rpg-session, prima-materia"
vlogs/kal-arath-episode-4.mdx,Vlogs,2026-05-08,Kal Arath Episode 4,"kal-arath, solo-rpg, rpg-session, prima-materia","kal-arath, solo-rpg, rpg-session, prima-materia"
vlogs/kal-arath-live-play-episode-3.mdx,Vlogs,2026-05-05,Kal Arath Live Play Episode 3,"kal-arath, solo-rpg, rpg-session, prima-materia","kal-arath, solo-rpg, rpg-session, prima-materia"
vlogs/kal-arath-live-play-session-1.mdx,Vlogs,2026-04-17,Kal Arath Live Play Session 1,"snow-effects, weathering, orcs-and-goblins, metal, terrain, rpg-session, painting","snow-effects, weathering, orcs-and-goblins, metal, terrain, rpg-session, painting"
vlogs/keeping-the-hobby-streak-alive-1.mdx,Vlogs,2026-03-23,Keeping the hobby streak alive.,"glazing, edge-highlighting, tips, infinity, painting","glazing, edge-highlighting, tips, infinity, painting"
vlogs/keeping-the-hobby-streak-alive.mdx,Vlogs,2026-01-30,Keeping the Hobby Streak Alive,"painting, hobby-streak, motivation, butcher","painting, hobby-motivation, butcher"
vlogs/lego-dnd-prep.mdx,Vlogs,2026-02-28,Lego D&D Prep,"dungeons-and-dragons, lego, ttrpg, family-gaming","dungeons-and-dragons, lego, ttrpg, family-gaming"
vlogs/loose-ends-and-crown-and-skull-session-0.mdx,Vlogs,2025-11-23,Loose Ends and Crown & Skull Session 0,"crown-and-skull, solo-rpg, pixel-art, airbrushing, character-creation, trench-crusade","crown-and-skull, solo-rpg, pixel-art, airbrushing, ttrpg, trench-crusade"
vlogs/mage-knight-dungeons-solo.mdx,Vlogs,2025-12-31,Mage Knight Dungeons Solo,"mage-knight, board-games, solo-rpg, dungeon-crawler, game-design","mage-knight, board-games, solo-rpg, dungeon-crawler, ttrpg"
vlogs/mail-day-1.mdx,Vlogs,2026-04-28,Mail day,"painting, metal, warmachine, mage-knight, orcs-and-goblins, unboxing","painting, metal, warmachine, mage-knight, orcs-and-goblins, unboxing"
vlogs/mail-day-and-what-s-coming-next.mdx,Vlogs,2026-05-28,Mail day and what’s coming next,"model-prep, warmachine, orcs-and-goblins, basing, metal, priming, terrain","model-prep, warmachine, orcs-and-goblins, basing, metal, priming, terrain"
vlogs/mail-day-rare-ral-partha-and-mage-knight-metals.mdx,Vlogs,2025-12-13,Mail Day - Rare Ral Partha and Mage Knight Metals,"mage-knight, nostalgia, collection, unboxing, mail-day, metal-miniatures","mage-knight, collection, unboxing, metal-miniatures"
vlogs/mail-day.mdx,Vlogs,2025-11-01,Mail Day,"unboxing, warmachine, dusk, mail-day, fantasm","unboxing, warmachine, dusk, fantasm"
vlogs/making-progress-on-maximus.mdx,Vlogs,2026-01-12,Pushing Through Maximus's White and Purple Armor,"painting, crucible-guard, dolmenwood, vlog, warmachine","painting, crucible-guard, dolmenwood, vlog, warmachine"
vlogs/may-24-2026.mdx,Vlogs,2026-05-25,"May 24, 2026","airbrushing, basing, painting, cloth","airbrushing, basing, painting, cloth"
vlogs/may-26-2026.mdx,Vlogs,2026-05-27,"May 26, 2026",,
vlogs/may-5-2026.mdx,Vlogs,2026-05-06,Wanted! Reward: CC 10000 Appliances on the Print Bed,3d-printing,3d-printing
vlogs/merging-stl-files-has-me-feeling-like-a-god.mdx,Vlogs,2025-12-23,Merging STL Files Has Me Feeling Like a God!,"3d-printing, vlog, stl-files","3d-printing, vlog"
vlogs/mistakes.mdx,Vlogs,2025-09-12,Fixing a Bad Speed Paint Job,"motivation, mistakes, robes, final-fantasy, painting","hobby-motivation, mistakes, robes, final-fantasy, painting"
vlogs/more-cleaning-vlog.mdx,Vlogs,2025-11-21,More Cleaning Vlog,"hobby-organization, trench-crusade, warmachine, dusk, vlog","workspace, trench-crusade, warmachine, dusk, vlog"
vlogs/more-progress-on-everything-im-working-on.mdx,Vlogs,2025-11-26,More Progress on Everything I'm Working On,"3d-printing, trench-crusade, leather, thanksgiving","3d-printing, trench-crusade, leather, thanksgiving"
vlogs/more-progress-on-the-children-of-gomb-entry.mdx,Vlogs,2026-03-09,More Progress on the Children of Gomb Entry,"children-of-gomb, pillage, midgard, painting, chain, normans, hobgoblin, hyperborea, inq28","children-of-gomb, pillage, midgard, painting, chain, normans, hobgoblin, hyperborea, inq28"
vlogs/more-progress-on-the-normans.mdx,Vlogs,2026-03-29,More Progress on the Normans,"painting, normans, historical-miniatures, leather, chainmail, speed-paints, metal","painting, normans, historical-miniatures, leather, chainmail, speed-painting, metal"
vlogs/my-first-one-piece-tcg-event.mdx,Vlogs,2026-01-11,My First One Piece TCG Event,"one-piece-tcg, card-games, competition, magic-the-gathering, vlog","one-piece-tcg, card-games, competition, magic-the-gathering, vlog"
vlogs/my-minimal-solo-rpg-kit.mdx,Vlogs,2026-04-17,My minimal solo rpg kit,"painting, rpg-session, snow-effects, orcs-and-goblins, wood, terrain, basing","painting, rpg-session, snow-effects, orcs-and-goblins, wood, terrain, basing"
vlogs/new-warmachine-caster.mdx,Vlogs,2026-04-06,New Warmachine Caster — Infernals Complete,"resin-casting, warmachine, priming, 3d-printing","resin-casting, warmachine, priming, 3d-printing"
vlogs/next-episode-of-kal-arath-is-almost-ready.mdx,Vlogs,2026-05-02,Next Episode of Kal Arath is Almost Ready,"kal-arath, solo-rpg, prima-materia","kal-arath, solo-rpg, prima-materia"
vlogs/nmm-blue-steel-scales-and-an-existential-crisis.mdx,Vlogs,2026-04-14,NMM Blue Steel Scales and an Existential Crisis,"painting, metal, orcs-and-goblins, glazing, washes, stripping, 3d-printing","painting, metal, orcs-and-goblins, glazing, washes, stripping, 3d-printing"
vlogs/no-making-the-same-mistakes-as-i-usually-do.mdx,Vlogs,2026-04-30,No making the same mistakes as I usually do,"kitbashing, warhammer, building, buying-selling, painting, event-photos, orcs-and-goblins","kitbashing, warhammer, building, buying-selling, painting, event-photos, orcs-and-goblins"
vlogs/old-school-sand-bases.mdx,Vlogs,2026-06-01,Old school sand bases,"basing, painting, building, airbrushing, wood, terrain, model-prep","basing, painting, building, airbrushing, wood, terrain, model-prep"
vlogs/one-of-my-new-favorites.mdx,Vlogs,2026-05-14,One of my new favorites.,books,books
vlogs/opening-20-year-old-mage-knight-boosters.mdx,Vlogs,2025-12-28,Opening 20 Year Old Mage Knight Boosters,"mage-knight, booster-opening, solo-rpg, collection, nostalgia","mage-knight, booster-opening, solo-rpg, collection"
